{
 "$schema": "../../spec/schema/tests.schema.json",
 "suite": "smoke",
 "kind": "special",
 "title": "Smoke tests: the tools of the machine (slot, workflow)",
 "tests": [
  {"id": "s01", "name": "s01_topology", "title": "Topology. The shape of a program: primary aspect, process, functions, procedures, regions.", "features": [], "status": "PASS", "runs": 152, "failures": 0, "checks": 0, "last": "2026-10-21 21:42", "mtime": 1792003006, "reason": ""},
  {"id": "s02", "name": "s02_logic", "title": "Logic. The truth values and their operators; an error here is absurd and obvious.", "features": [], "status": "PASS", "runs": 154, "failures": 0, "checks": 0, "last": "2026-10-21 21:42", "mtime": 1792002920, "reason": ""},
  {"id": "s03", "name": "s03_numeric", "title": "Numbers. Zero, one, the extremes of the types, the operators and the literals.", "features": [], "status": "PASS", "runs": 152, "failures": 0, "checks": 0, "last": "2026-10-21 21:42", "mtime": 1792002920, "reason": ""},
  {"id": "s04", "name": "s04_string", "title": "Strings. The empty string, concatenation, comparison, escapes and placeholders.", "features": [], "status": "PASS", "runs": 152, "failures": 0, "checks": 0, "last": "2026-10-21 21:42", "mtime": 1792470166, "reason": ""},
  {"id": "s05", "name": "s05_collection", "title": "Collections. The empty ones, zero values, one element, indexes from 1, literals.", "features": [], "status": "PASS", "runs": 152, "failures": 0, "checks": 0, "last": "2026-10-21 21:42", "mtime": 1792470166, "reason": ""},
  {"id": "s06", "name": "s06_variables", "title": "Variables. new, set and let; constants; sharing and copying; scopes.", "features": [], "status": "PASS", "runs": 152, "failures": 0, "checks": 0, "last": "2026-10-21 21:42", "mtime": 1792608750, "reason": ""},
  {"id": "s07", "name": "s07_constants", "title": "Constants. set declares a value that never changes: typed or not, global or local.", "features": [], "status": "PASS", "runs": 152, "failures": 0, "checks": 0, "last": "2026-10-21 21:42", "mtime": 1792608750, "reason": ""},
  {"id": "s08", "name": "s08_constant_assign", "title": "A constant can't be changed. Assigning it is a compile error and nothing runs.", "features": [], "status": "PASS", "runs": 152, "failures": 0, "checks": 0, "last": "2026-10-21 21:42", "mtime": 1792470166, "reason": ""},
  {"id": "s09", "name": "s09_operators", "title": "Operators. Precedence, compound forms, list operators, ranges, membership.", "features": [], "status": "PASS", "runs": 152, "failures": 0, "checks": 0, "last": "2026-10-21 21:42", "mtime": 1792470166, "reason": ""},
  {"id": "s10", "name": "s10_control", "title": "Control flow. if, while, loop, for, match, break, skip, labels, the if suffix.", "features": [], "status": "PASS", "runs": 152, "failures": 0, "checks": 0, "last": "2026-10-21 21:42", "mtime": 1792002920, "reason": ""},
  {"id": "s11", "name": "s11_subprograms", "title": "Subprograms. Functions, procedures, arguments, recursion, lambdas, closures.", "features": [], "status": "PASS", "runs": 152, "failures": 0, "checks": 0, "last": "2026-10-21 21:42", "mtime": 1792002920, "reason": ""},
  {"id": "s12", "name": "s12_errors", "title": "Errors. raise and recover, jobs with resume, error codes, defer, exit, over, finalize.", "features": [], "status": "PASS", "runs": 152, "failures": 0, "checks": 0, "last": "2026-10-21 21:42", "mtime": 1792002920, "reason": ""},
  {"id": "s13", "name": "s13_types", "title": "Types. type(), is, conversions, optional values, ordinals, variants.", "features": [], "status": "PASS", "runs": 152, "failures": 1, "checks": 0, "last": "2026-10-21 21:42", "mtime": 1792002920, "reason": ""},
  {"id": "s14", "name": "s14_objects", "title": "Objects. Class, methods, visibility, inheritance, extension, comparison.", "features": [], "status": "PASS", "runs": 152, "failures": 0, "checks": 0, "last": "2026-10-21 21:42", "mtime": 1792470166, "reason": ""},
  {"id": "s15", "name": "s15_placeholders", "title": "Placeholders. Names, literals, expressions, formats, code points, entities, braces.", "features": [], "status": "PASS", "runs": 152, "failures": 0, "checks": 0, "last": "2026-10-21 21:42", "mtime": 1792002920, "reason": ""},
  {"id": "s16", "name": "s16_project", "title": "A project. One module, one aspect, one apply: import, life cycle order, safe and Atomic.", "features": [], "status": "PASS", "runs": 152, "failures": 2, "checks": 0, "last": "2026-10-21 21:42", "mtime": 1792002920, "reason": ""},
  {"id": "s17", "name": "s17_tasks", "title": "Tasks. async procedures spawned in a job, an async function awaited, a job that waits for all of them.", "features": [], "status": "PASS", "runs": 46, "failures": 0, "checks": 0, "last": "2026-10-21 21:42", "mtime": 1792307943, "reason": ""},
  {"id": "s18", "name": "s18_generics", "title": "Generics and traits. A generic procedure, a generic class, a trait with a required and a provided method.", "features": [], "status": "PASS", "runs": 46, "failures": 0, "checks": 0, "last": "2026-10-21 21:42", "mtime": 1792307936, "reason": ""},
  {"id": "s19", "name": "s19_data", "title": "Data files. Records in a Table, written as CSV and as JSON Lines, read back typed; Decimal keeps its scale.", "features": [], "status": "PASS", "runs": 46, "failures": 0, "checks": 0, "last": "2026-10-21 21:42", "mtime": 1792307943, "reason": ""},
  {"id": "s20", "name": "s20_database", "title": "Database. SQLite of the machine: a table, typed parameters, records, a job that rolls back, a Memory table there and back.", "features": [], "status": "PASS", "runs": 46, "failures": 0, "checks": 0, "last": "2026-10-21 21:42", "mtime": 1792307936, "reason": ""},
  {"id": "s21", "name": "s21_machine", "title": "The machine. A listening machine runs a script sent with -loc, the stdio door runs session commands, --listen stop ends it.", "features": [], "status": "PASS", "runs": 46, "failures": 0, "checks": 0, "last": "2026-10-21 21:42", "mtime": 1792307967, "reason": ""}
 ]
}
