{
 "$schema": "../../spec/schema/tests.schema.json",
 "suite": "level6",
 "kind": "level",
 "title": "Level 6: The Eve machine and the server",
 "tests": [
  {"id": "f03", "name": "f03_test_module", "title": "the standard module test, written in Eve: checks print one line, count, and summary raises when one failed", "features": ["F-LIB-12"], "status": "PASS", "runs": 51, "failures": 0, "checks": 0, "last": "2026-10-24 16:11", "mtime": 1792544667, "reason": ""},
  {"id": "f04", "name": "f04_crypto", "title": "the system module crypto: hashes, HMAC, codecs, random bytes (F-LIB-10)", "features": ["F-LIB-10"], "status": "PASS", "runs": 50, "failures": 0, "checks": 0, "last": "2026-10-24 16:11", "mtime": 1792544667, "reason": ""},
  {"id": "f05", "name": "f05_os", "title": "the system module os: run a program without a shell, read the environment (F-LIB-07)", "features": ["F-LIB-07"], "status": "PASS", "runs": 51, "failures": 0, "checks": 0, "last": "2026-10-24 16:11", "mtime": 1792544667, "reason": ""},
  {"id": "f06", "name": "f06_json_text", "title": "json.parse and json.text: JSON text in memory and plain values (F-LIB-05)", "features": ["F-LIB-05"], "status": "PASS", "runs": 49, "failures": 0, "checks": 0, "last": "2026-10-24 16:11", "mtime": 1792544667, "reason": ""},
  {"id": "f07", "name": "f07_rpc", "title": "the standard module rpc, in Eve: build JSON-RPC 2.0 lines (F-NET-08)", "features": ["F-NET-08"], "status": "PASS", "runs": 49, "failures": 0, "checks": 0, "last": "2026-10-24 16:11", "mtime": 1792544667, "reason": ""},
  {"id": "f08", "name": "f08_config", "title": "the standard module config, in Eve: key = value files into a DataMap (F-TLS-12)", "features": ["F-TLS-12"], "status": "PASS", "runs": 47, "failures": 0, "checks": 0, "last": "2026-10-24 16:11", "mtime": 1792544667, "reason": ""},
  {"id": "f09", "name": "f09_net", "title": "the system module net: a server and a client as tasks of one script, lines over TCP (F-NET-02)", "features": ["F-NET-03"], "status": "PASS", "runs": 46, "failures": 0, "checks": 0, "last": "2026-10-24 16:11", "mtime": 1792608750, "reason": ""},
  {"id": "f10", "name": "f10_route_hello", "title": "a server with routes and a client in one script: the modules net, http, route and service (F-NET-02, F-STR-08)", "features": ["F-NET-02"], "status": "PASS", "runs": 45, "failures": 0, "checks": 0, "last": "2026-10-24 16:11", "mtime": 1792544667, "reason": ""},
  {"id": "f11", "name": "f11_rpc_roundtrip", "title": "JSON-RPC 2.0 over HTTP between a server and a client on localhost: rpc, http, route, service and net together (F-NET-08)", "features": ["F-NET-08"], "status": "PASS", "runs": 43, "failures": 0, "checks": 0, "last": "2026-10-24 16:11", "mtime": 1792544667, "reason": ""},
  {"id": "f12", "name": "f12_service_close", "title": "a service with no count runs until its listener is closed; close wakes the pending accept (F-NET-02)", "features": ["F-NET-02"], "status": "PASS", "runs": 43, "failures": 0, "checks": 0, "last": "2026-10-24 16:11", "mtime": 1792544667, "reason": ""},
  {"id": "f13", "name": "f13_net_timeout", "title": "set_timeout: a read that waits too long fails with $err_timeout and the server goes on (TD-27)", "features": ["F-NET-10"], "status": "PASS", "runs": 29, "failures": 0, "checks": 0, "last": "2026-10-24 16:11", "mtime": 1792438272, "reason": ""},
  {"id": "f14", "name": "f14_service_idle", "title": "a client that sends nothing gets a 408 after the idle time and the next client is served (TD-29)", "features": ["F-NET-02", "F-NET-10"], "status": "PASS", "runs": 28, "failures": 0, "checks": 0, "last": "2026-10-24 16:11", "mtime": 1792438314, "reason": ""},
  {"id": "f15", "name": "f15_os_timeout", "title": "os.run! with a time-out: the child is killed, status 124 (TD-9, TD-27)", "features": ["F-LIB-07", "F-NET-10"], "status": "PASS", "runs": 28, "failures": 1, "checks": 0, "last": "2026-10-24 16:11", "mtime": 1792438511, "reason": ""},
  {"id": "f16", "name": "f16_os_env", "title": "os.run! gives variables to the program it starts: a map String -> String is added to its environment (CMD-04, G-10)", "features": ["F-LIB-07"], "status": "PASS", "runs": 16, "failures": 0, "checks": 0, "last": "2026-10-24 16:11", "mtime": 1792544667, "reason": ""}
 ]
}
