{
 "suite": "bytecode",
 "kind": "special",
 "title": "Bytecode machine: small programs for each group of instructions, run on the bytecode engine",
 "tests": [
  {"id": "bc01_arithmetic", "name": "bc01_arithmetic", "title": "every arithmetic instruction on integers and reals, the sign and the precedence", "features": [], "status": "PASS", "runs": 44, "failures": 0, "checks": 0, "last": "2026-10-25 13:19", "mtime": 1792496214, "reason": ""},
  {"id": "bc02_compare_logic", "name": "bc02_compare_logic", "title": "comparison instructions, not, and, or, and the short circuit", "features": [], "status": "PASS", "runs": 44, "failures": 0, "checks": 0, "last": "2026-10-25 13:19", "mtime": 1792496214, "reason": ""},
  {"id": "bc03_loops", "name": "bc03_loops", "title": "forprep and forloop over ranges, while with jumps, nested loops", "features": [], "status": "PASS", "runs": 44, "failures": 0, "checks": 0, "last": "2026-10-25 13:19", "mtime": 1792496214, "reason": ""},
  {"id": "bc04_calls", "name": "bc04_calls", "title": "callf and ret: parameters, results, recursion and calls inside expressions", "features": [], "status": "PASS", "runs": 44, "failures": 0, "checks": 0, "last": "2026-10-25 13:19", "mtime": 1792496214, "reason": ""},
  {"id": "bc05_lists", "name": "bc05_lists", "title": "new_list, list_push, list_index, list_set, length, negative index", "features": [], "status": "PASS", "runs": 44, "failures": 0, "checks": 0, "last": "2026-10-25 13:19", "mtime": 1792496214, "reason": ""},
  {"id": "bc06_maps", "name": "bc06_maps", "title": "new_map, map_set, map_get and the length of a map", "features": [], "status": "PASS", "runs": 44, "failures": 0, "checks": 0, "last": "2026-10-25 13:19", "mtime": 1792496214, "reason": ""},
  {"id": "bc07_strings", "name": "bc07_strings", "title": "strings: concatenation, interpolation, length, comparison, write and print", "features": [], "status": "PASS", "runs": 44, "failures": 0, "checks": 0, "last": "2026-10-25 13:19", "mtime": 1792496214, "reason": ""},
  {"id": "bc08_augment", "name": "bc08_augment", "title": "augment: compound assignment on numbers, strings and lists", "features": [], "status": "PASS", "runs": 44, "failures": 0, "checks": 0, "last": "2026-10-25 13:19", "mtime": 1792496214, "reason": ""},
  {"id": "bc09_coerce", "name": "bc09_coerce", "title": "coerce and setlike: a declared type converts the value it receives", "features": [], "status": "PASS", "runs": 44, "failures": 0, "checks": 0, "last": "2026-10-25 13:19", "mtime": 1792496214, "reason": ""},
  {"id": "bc10_expect_failure", "name": "bc10_expect_failure", "title": "expect raises an error with the exit code 2 and the machine stops", "features": [], "status": "PASS", "runs": 44, "failures": 0, "checks": 0, "last": "2026-10-25 13:19", "mtime": 1792496214, "reason": ""},
  {"id": "bc11_errors", "name": "bc11_errors", "title": "a run-time error (division by zero, an index out of range) is the same error on the machine", "features": [], "status": "PASS", "runs": 44, "failures": 0, "checks": 0, "last": "2026-10-25 13:19", "mtime": 1792496214, "reason": ""},
  {"id": "bc12_bridge", "name": "bc12_bridge", "title": "a loop over a list literal runs natively: iterprep and iterloop", "features": [], "status": "PASS", "runs": 44, "failures": 0, "checks": 0, "last": "2026-10-25 13:19", "mtime": 1792496214, "reason": ""},
  {"id": "bc13_class_fallback", "name": "bc13_class_fallback", "title": "a script with a class or a lambda is not translated yet (the emitter says so): it runs entirely on the tree walker with the same result (TD-46)", "features": [], "status": "PASS", "runs": 44, "failures": 0, "checks": 0, "last": "2026-10-25 13:19", "mtime": 1792496214, "reason": ""},
  {"id": "bc14_recover", "name": "bc14_recover", "title": "recover, retry, resume and finalize of the process main run with the bytecode body", "features": [], "status": "PASS", "runs": 44, "failures": 0, "checks": 0, "last": "2026-10-25 13:19", "mtime": 1792496214, "reason": ""},
  {"id": "bc15_retry", "name": "bc15_retry", "title": "retry runs the failing statement again with the variables the recover block changed", "features": [], "status": "PASS", "runs": 44, "failures": 0, "checks": 0, "last": "2026-10-25 13:19", "mtime": 1792496214, "reason": ""},
  {"id": "bc16_collections", "name": "bc16_collections", "title": "lists, maps and sets: literals, index and store, push, loops over each kind, empty collections", "features": [], "status": "PASS", "runs": 44, "failures": 0, "checks": 0, "last": "2026-10-25 13:19", "mtime": 1792496214, "reason": ""},
  {"id": "bc17_interpolation", "name": "bc17_interpolation", "title": "interpolation with names, expressions inside the braces and several parts", "features": [], "status": "PASS", "runs": 44, "failures": 0, "checks": 0, "last": "2026-10-25 13:19", "mtime": 1792496214, "reason": ""},
  {"id": "bc18_shared_names", "name": "bc18_shared_names", "title": "constants and variables of the aspect, a class and a destructor are reached by name; the safe points free in the same order", "features": [], "status": "PASS", "runs": 44, "failures": 0, "checks": 0, "last": "2026-10-25 13:19", "mtime": 1792496214, "reason": ""},
  {"id": "bc19_rational", "name": "bc19_rational", "title": "Rational literals are constants of the chunk (loadk) and the arithmetic of fractions runs on the machine without the tree walker", "features": [], "status": "PASS", "runs": 26, "failures": 0, "checks": 0, "last": "2026-10-25 13:19", "mtime": 1792865536, "reason": ""},
  {"id": "bc20_complex", "name": "bc20_complex", "title": "Imaginary literals are constants of the chunk (loadk) and the arithmetic of complex numbers runs on the machine", "features": [], "status": "PASS", "runs": 25, "failures": 0, "checks": 0, "last": "2026-10-25 13:19", "mtime": 1792866754, "reason": ""},
  {"id": "bc21_duration", "name": "bc21_duration", "title": "Duration literals are constants of the chunk (loadk) and their arithmetic runs on the machine", "features": [], "status": "PASS", "runs": 21, "failures": 0, "checks": 0, "last": "2026-10-25 13:19", "mtime": 1792873111, "reason": ""},
  {"id": "bc22_dates", "name": "bc22_dates", "title": "Date and Time values run on the machine: functions of the module time, + and - with days and Durations, comparison", "features": [], "status": "PASS", "runs": 20, "failures": 0, "checks": 0, "last": "2026-10-25 13:19", "mtime": 1792874233, "reason": ""},
  {"id": "bridge", "name": "bridge", "title": "what the emitter does not translate runs on the tree walker (TD-46)", "features": [], "status": "PASS", "runs": 44, "failures": 0, "checks": 0, "last": "2026-10-25 13:19", "mtime": 1792496214, "reason": ""},
  {"id": "loop_call", "name": "loop_call", "title": "a loop that calls a function", "features": [], "status": "PASS", "runs": 44, "failures": 0, "checks": 0, "last": "2026-10-25 13:19", "mtime": 1792496214, "reason": ""}
 ]
}
